{
  "id": "ages-industrial",
  "title": "Industrial",
  "tags": [
    "interior",
    "ages"
  ],
  "clearColor": "#1a1816",
  "materials": {
    "floor": "scifi.scrap",
    "shell": "scifi.hull",
    "accent": "#b09070"
  },
  "atmosphere": {
    "density": 1
  },
  "shell": {
    "halfX": 8,
    "zMin": -6.2,
    "zMax": 5.2
  },
  "sockets": [
    {
      "id": "entry",
      "role": "entry",
      "position": [
        0,
        1,
        0
      ],
      "yaw": 3.141592653589793,
      "wall": "south"
    },
    {
      "id": "exit-a",
      "role": "exit",
      "position": [
        0,
        1,
        -6.2
      ],
      "yaw": 0,
      "wall": "north"
    },
    {
      "id": "exit-b",
      "role": "exit",
      "position": [
        -8,
        1,
        1.2
      ],
      "yaw": 1.5707963267948966,
      "wall": "west"
    },
    {
      "id": "exit-c",
      "role": "exit",
      "position": [
        8,
        1,
        1.2
      ],
      "yaw": -1.5707963267948966,
      "wall": "east"
    },
    {
      "id": "exit-d",
      "role": "exit",
      "position": [
        -8,
        1,
        -3.2
      ],
      "yaw": 1.5707963267948966,
      "wall": "west"
    }
  ],
  "dressing": [
    {
      "kind": "prop.box",
      "position": [
        7,
        0.4,
        3.2
      ],
      "tags": [
        "landmark"
      ],
      "props": {
        "size": [
          0.8,
          0.8,
          0.8
        ],
        "material": "scifi.armor"
      }
    },
    {
      "kind": "prop.ring",
      "position": [
        0,
        1.9,
        -3.4
      ],
      "props": {
        "radius": 1.6,
        "tube": 0.13,
        "material": "scifi.gate.ring"
      }
    }
  ],
  "topologies": [
    "plus",
    "shaft"
  ]
}
