{
  "id": "haunt-attic",
  "title": "Attic",
  "tags": [
    "interior",
    "haunt",
    "secret"
  ],
  "clearColor": "#18120c",
  "materials": {
    "floor": "shared.stone",
    "shell": "shared.plaster",
    "accent": "#d4a060"
  },
  "atmosphere": {
    "density": 1.4
  },
  "topologies": [
    "loft",
    "alcove"
  ],
  "dressing": [
    {
      "kind": "prop.box",
      "tags": [
        "landmark"
      ],
      "props": {
        "size": [
          1.4,
          0.8,
          0.9
        ],
        "color": "#c48830"
      }
    },
    {
      "kind": "prop.box",
      "props": {
        "size": [
          0.9,
          0.6,
          1.6
        ],
        "color": "#2e2418"
      }
    },
    {
      "kind": "prop.candle",
      "props": {
        "intensity": 0.2
      }
    },
    {
      "kind": "prop.candle",
      "props": {
        "intensity": 0.16
      }
    }
  ]
}
