{
  "id": "mix-dirt-gold",
  "title": "Gilded dirt",
  "tags": [
    "interior",
    "ages",
    "prehistoric"
  ],
  "clearColor": "#22180c",
  "materials": {
    "floor": "ages.dirt",
    "shell": "ages.dirt",
    "strip": "cyber.strip.gold",
    "accent": "#f0c040"
  },
  "atmosphere": {
    "density": 1
  },
  "topologies": [
    "court",
    "L"
  ],
  "dressing": [
    {
      "kind": "prop.hearth",
      "tags": [
        "landmark"
      ],
      "props": {
        "ember": "#f0c040",
        "intensity": 1.3
      }
    },
    {
      "kind": "prop.box",
      "props": {
        "size": [
          2.2,
          0.5,
          0.8
        ],
        "color": "#f0c040"
      }
    },
    {
      "kind": "prop.box",
      "props": {
        "size": [
          0.4,
          1.6,
          0.4
        ],
        "color": "#6a4a28"
      }
    }
  ]
}
